{
  "reviewedAt": "2026-10-20",
  "sources": [
    {
      "id": "defense",
      "title": "官方：侦察、防御建筑与补墙",
      "url": "https://www.ageofempires.com/learn-to-play/defending-your-empires-aoe2/",
      "date": "发布日期未标注，2026-10-20 核对",
      "scope": "采用侦察、保护经济、墙争取时间和防御建筑位置的原则。其 Arabia 出生配置不用于本页。"
    },
    {
      "id": "military",
      "title": "官方：攻城与经济调整",
      "url": "https://www.ageofempires.com/learn-to-play/military-and-economy-aoe2/",
      "date": "发布日期未标注，2026-10-20 核对",
      "scope": "采用攻城器需要保护、远程拆建筑和按计划重配经济的原则；具体时代与文明资格仍以本站固定版科技树为准。"
    },
    {
      "id": "arena",
      "title": "AOE2 Guide：Arena 地图与攻防",
      "url": "https://aoe2.guide/arena/",
      "date": "2024-09-30",
      "scope": "采用封闭空间、前置独特单位压力及后续攻城路线的说明，不照搬文明排名、人数或必胜判断。"
    },
    {
      "id": "forward",
      "title": "AOE2 Guide：前置城堡的投入与风险",
      "url": "https://aoe2.guide/why-i-typically-disagree-with-the-forward-castle/",
      "date": "2020-05-26",
      "scope": "只采用采集、行军和前压落点有代价的分析，不采纳其固定人数、前置通常失败等绝对化结论。"
    }
  ],
  "stages": {
    "stone": {
      "title": "疑似准备：先确认，不急着改全盘计划",
      "summary": "提前采石是线索，还不能认定对手正在城堡前置。先把资源、通路和侦察信息补齐。",
      "checks": [
        "敌方到什么时代了？采石是在持续进行，还是只看到过一次？",
        "是否看到村民离家、护送兵力或前置建筑？可能的落点在哪里？",
        "自己的外侧资源和内侧退路是否已看清？"
      ],
      "actions": ["observe", "prepare"]
    },
    "construction": {
      "title": "前压或施工：先判断能否及时、安全地打断",
      "summary": "目标是尚未完工的工程及建筑者。先看护军、到场时间与撤回路线，不把拉村民当固定答案。",
      "checks": [
        "只是看到前压村民，还是已经看到堡基？施工离完成还有多远？",
        "现有兵力能否及时到场？护军类型和增援是否已确认？",
        "如果打断失败，村民、军队和资源点能撤到哪里？"
      ],
      "actions": ["prepare"]
    },
    "relocate": {
      "title": "城堡已成，仍有退路：让地后恢复经济",
      "summary": "先保住村民、生产和安全采集点。击杀建筑者已不能取消这座城堡，也不必立刻正面拆堡。",
      "checks": [
        "替代资源点和连接它们的路线真的安全，还是尚未探明？",
        "哪些生产建筑、房屋和采集点正受到威胁？",
        "敌方城堡接下来生产什么？是否还有爆破、攻城器或第二次前压？"
      ],
      "actions": ["relocate", "hold"]
    },
    "blocked": {
      "title": "关键资源封锁：先保剩余空间，再选解围路线",
      "summary": "先盘点还能采什么、还能生产什么。防守建筑、军队和升时代会争用同一份经济，不能同时默认都能完成。",
      "checks": [
        "被封的是哪项关键资源？剩余安全存量、采集点和通路各在哪里？",
        "本方科技树、当前时代、生产建筑和资源能支持什么？",
        "可否保护施工者或攻城器？对方后续兵力会不会继续压缩空间？"
      ],
      "actions": ["remnant", "hold"]
    },
    "resources-unknown": {
      "title": "城堡已成，资源情况未知：先查退路",
      "summary": "尚不能确定该让地恢复，还是需要解围。先确认安全资源与通路，再进入对应分支；未知不等于可迁移。",
      "checks": [
        "替代木线、金矿与石矿是否仍可采集？哪些只是未探明？",
        "村民到替代资源点是否必须经过敌军或城堡威胁区？",
        "内侧是否还有可守的经济空间和生产建筑？"
      ],
      "actions": ["verify", "hold"]
    }
  },
  "actions": {
    "observe": {
      "title": "保持侦察，核对前压是否发生",
      "body": "用能安全保留的视野跟踪出门村民、护军与落点；不要为了追踪线索把唯一的侦察单位白送。",
      "cost": "侦察需要注意力，也有损失单位的风险；过早投入防守可能拖慢自己的计划。",
      "counterexample": "只有采石、没有看见前压，并不能排除家中防守或其他建筑用途。",
      "next": "看见村民前压、堡基、护军增援，或发现原先判断有误时，重新选择观察状态。",
      "sources": ["defense", "forward"]
    },
    "prepare": {
      "title": "先准备内侧退路与资源备选",
      "body": "确认暴露资源点的撤回方向，查看内侧可补墙或布置防守的位置。前压已确认且有安全施工空间时，再用墙或建筑争取调整时间。",
      "cost": "搬迁和施工都会停采、消耗资源；投入过多也会挤占出兵和升时代。",
      "counterexample": "未探明的位置不算安全落点；敌军已切断施工通路时，不能让村民去补一段来不及完成的墙。",
      "next": "复查工程进度、护军动向与撤回通路。城堡一旦完成，就切换到已完工分支。",
      "sources": ["defense", "arena"]
    },
    "intercept": {
      "title": "条件允许时，尝试打断建筑者",
      "body": "你已确认未见护军且有安全通路，仍需判断现有兵力是否赶得上、能否打赢并安全撤回。只有这些条件成立才考虑拦截。若考虑村民，还要检查织布、敌方建筑者反击与停采代价。",
      "cost": "离开防线会暴露军队或村民；打断失败可能同时损失单位和经济时间。",
      "counterexample": "看见新增护军、通路变化或城堡即将完工时，不继续按原计划强冲；本页不给固定出动人数。",
      "next": "持续看护军增援和施工进度。不能及时处理时，撤回并转为保护经济。",
      "sources": ["defense", "forward"]
    },
    "verify": {
      "title": "先确认还能安全采集的资源",
      "body": "核对替代资源点、村民通路和内侧空间。能迁移与完全封锁需要不同投入，先补信息再决定。",
      "cost": "查证也需要时间；同时先撤离已知危险区域，避免让村民等待结论时继续暴露。",
      "counterexample": "地图上有资源并不代表能安全抵达；城堡射界、敌军位置和后续进攻仍可能改变路线。",
      "next": "确认后将资源状态改为可迁移或关键资源封锁；仍未知就保留未知。",
      "sources": ["defense", "arena"]
    },
    "relocate": {
      "title": "路线安全时，让地并恢复采集",
      "body": "先把受威胁村民撤回，再恢复关键资源与生产。若安全路径仍未知，先查路线，不直接把村民派往未探明位置。",
      "cost": "新的采集建筑、搬迁路程和重新安排村民都有代价；可用空间也可能缩小。",
      "counterexample": "替代点已被封或途中有敌军时，这条路线不成立，应转到封锁分支重新判断。",
      "next": "复查新资源点、生产建筑和通路是否仍安全，观察敌方是否继续前置。",
      "sources": ["defense", "military", "arena"]
    },
    "hold": {
      "title": "保护剩余经济，盯住后续部队",
      "body": "在有安全施工空间时，用内侧墙或建筑争取时间；根据真正出现的独特单位、攻城器与护军调整防守。城堡已成后，重点转向其后续推进。",
      "cost": "补墙、防守与维持生产会争用资源；等待也可能让对方集结更多兵力。",
      "counterexample": "墙不是永久保护，爆破、攻城或绕过防线都可能使它失效；城堡前置也不证明我方经济领先。",
      "next": "发现破墙手段、射程变化、更多军队或新的前置建筑时，重新评估资源状态和防守路线。",
      "sources": ["defense", "arena"]
    },
    "remnant": {
      "title": "盘点剩余资源，优先保住可执行的防守",
      "body": "列出当前还能安全采集、使用的资源和生产建筑，先守住村民及必要通路。根据缺口重配经济，不把升时代、造堡和大量出兵同时当成已备好的方案。",
      "cost": "让地会放弃部分建筑和空间；集中资源防守会推迟其他投入。",
      "counterexample": "只看库存、不考虑资源续采和村民安全，可能让方案执行到一半就停下。",
      "next": "新的安全采集点或通路恢复后，改用迁移分支；封锁加深时重新核对可用手段。",
      "sources": ["military", "arena"]
    },
    "castle": {
      "title": "有安全落点和投入时，再考虑防守城堡",
      "body": "先在自身科技树确认建筑资格，再核对材料、施工者、保护和有效位置。防守城堡要能保护剩余经济或通路，不能只为与敌堡对射而盲放。",
      "cost": "采石、行军和施工占用经济，也会推迟军队、生产或升时代。",
      "counterexample": "没有安全施工空间、所需材料或保护时，落堡可能再丢村民；位置不覆盖关键区域也解决不了封锁。",
      "next": "复查敌方射界、护军与后续攻城，确认施工位置仍有作用。",
      "sources": ["defense", "forward"]
    },
    "siege": {
      "title": "核对攻城手段与护卫，再谈解围",
      "body": "只有本方科技树已开放、生产前置和资源齐全、且能保护攻城器与通路时，才考虑对应攻城路线。若使用冲车，先处理近战护军等威胁，不让冲车独自送到城堡下。",
      "cost": "攻城器、生产建筑、科技和护卫需要一起投入；损失攻城器会拖慢后续方案。",
      "counterexample": "能生产某种攻城器不等于能拆掉受保护的城堡；本页不模拟射界、微操、维修或拆堡胜负。",
      "next": "复查护军类型、通路、攻城器保护与敌方新增兵力，条件变化就暂停原路线。",
      "sources": ["military", "arena"]
    },
    "trebuchet": {
      "title": "帝王时代的远程解围备选",
      "body": "巨型投石机只作为有条件的备选：先确认本方科技树允许、相应生产建筑与资源齐全，并能保护其展开位置和护卫通路，再考虑远程拆堡。",
      "cost": "远程攻城器、护卫与生产占用资源；对方也可能修堡或以军队和攻城器反制。",
      "counterexample": "已到帝王不代表现有文明和建筑立即能生产；无人保护、展开位置危险时不应直接出击。",
      "next": "检查对方反攻城手段、维修和侧翼变化，保持护卫与撤回通路。",
      "sources": ["military", "arena"]
    },
    "future-castle": {
      "title": "后续准备：确认升时代与防守建筑前提",
      "body": "本页不把防守城堡列为当前时代可立即执行的方案。先稳定剩余经济，再核对本方科技树的时代、材料、施工者、保护和落点条件。",
      "cost": "升级时代与准备材料会占用本可用于眼前防守的资源。",
      "counterexample": "当前防守撑不住时，只存资源等待后续建筑可能过晚。",
      "next": "时代和建筑前提满足后，再核对安全落点；不要直接沿用旧位置。",
      "sources": ["defense", "military"]
    },
    "future-trebuchet": {
      "title": "后续准备：升帝王后的远程解围路线",
      "body": "尚未到帝王，巨型投石机不属于本页的立即行动。只有能守住过渡期，并核对本方科技树、生产建筑、资源与保护条件后，才把升帝王后的远程拆堡列入计划。",
      "cost": "升时代和准备攻城器会挤占当前防守；对手也可能更早推进或完成自己的升级。",
      "counterexample": "不能因为对方投入了前置，就认定自己一定先帝王或必能拆堡。",
      "next": "复查过渡期是否守得住、双方时代和实际生产前提；信息变化就重选路线。",
      "sources": ["military", "arena", "forward"]
    }
  }
}
